{
  "schemaVersion": 1,
  "bankVersion": "diagnostic-v1-bank.2.0.0-candidate",
  "status": "CANDIDATE_NOT_APPROVED",
  "reviewedAt": "2026-10-24",
  "reviewerKind": "LLM_ASSISTANT_NOT_INDEPENDENT_ASSESSOR",
  "entries": [
    {
      "questionId": "diagv1.a.g1.r1",
      "formId": "form-a",
      "domain": "grammar",
      "authorship": "REUSED_WORDING_OPTIONS_REORDERED",
      "legacyId": "G1",
      "contentReviewMethod": "LLM_ASSISTED_SELF_REVIEW",
      "independentHumanReview": "PENDING",
      "contentReviewOutcome": "NO_IDENTIFIED_AMBIGUITY_AFTER_SELF_REVIEW",
      "candidateReadiness": "CONTENT_READY_FOR_HUMAN_REVIEW",
      "rightsReview": "PENDING_OWNER_ATTESTATION",
      "keyApproval": "PENDING_HUMAN",
      "scoringEligible": false,
      "blockers": [
        "HUMAN_CONTENT_REVIEW",
        "SOURCE_RIGHTS_ATTESTATION",
        "OWNER_FREEZE"
      ],
      "reviewNote": "Historical wording/labels retained; new immutable option order/IDs only. Prior weak-distractor limitations remain; independent human review required.",
      "approvedBy": null,
      "approvedAt": null,
      "provenanceIds": [
        "source-authoring",
        "source-legacy-data"
      ]
    },
    {
      "questionId": "diagv1.a.g02.r1",
      "formId": "form-a",
      "domain": "grammar",
      "authorship": "REVISED_LLM_ASSISTED",
      "legacyId": "G2",
      "contentReviewMethod": "LLM_ASSISTED_SELF_REVIEW",
      "independentHumanReview": "PENDING",
      "contentReviewOutcome": "NO_IDENTIFIED_AMBIGUITY_AFTER_SELF_REVIEW",
      "candidateReadiness": "CONTENT_READY_FOR_HUMAN_REVIEW",
      "rightsReview": "PENDING_OWNER_ATTESTATION",
      "keyApproval": "PENDING_HUMAN",
      "scoringEligible": false,
      "blockers": [
        "HUMAN_CONTENT_REVIEW",
        "SOURCE_RIGHTS_ATTESTATION",
        "OWNER_FREEZE"
      ],
      "reviewNote": "Addresses temporal ambiguity by naming the target form; recognition task, not calibrated tense proficiency.",
      "approvedBy": null,
      "approvedAt": null,
      "provenanceIds": [
        "source-authoring",
        "source-legacy-data"
      ]
    },
    {
      "questionId": "diagv1.a.g3.r1",
      "formId": "form-a",
      "domain": "grammar",
      "authorship": "REUSED_WORDING_OPTIONS_REORDERED",
      "legacyId": "G3",
      "contentReviewMethod": "LLM_ASSISTED_SELF_REVIEW",
      "independentHumanReview": "PENDING",
      "contentReviewOutcome": "NO_IDENTIFIED_AMBIGUITY_AFTER_SELF_REVIEW",
      "candidateReadiness": "CONTENT_READY_FOR_HUMAN_REVIEW",
      "rightsReview": "PENDING_OWNER_ATTESTATION",
      "keyApproval": "PENDING_HUMAN",
      "scoringEligible": false,
      "blockers": [
        "HUMAN_CONTENT_REVIEW",
        "SOURCE_RIGHTS_ATTESTATION",
        "OWNER_FREEZE"
      ],
      "reviewNote": "Historical wording/labels retained; new immutable option order/IDs only. Prior weak-distractor limitations remain; independent human review required.",
      "approvedBy": null,
      "approvedAt": null,
      "provenanceIds": [
        "source-authoring",
        "source-legacy-data"
      ]
    },
    {
      "questionId": "diagv1.a.g4.r1",
      "formId": "form-a",
      "domain": "grammar",
      "authorship": "REUSED_WORDING_OPTIONS_REORDERED",
      "legacyId": "G4",
      "contentReviewMethod": "LLM_ASSISTED_SELF_REVIEW",
      "independentHumanReview": "PENDING",
      "contentReviewOutcome": "NO_IDENTIFIED_AMBIGUITY_AFTER_SELF_REVIEW",
      "candidateReadiness": "CONTENT_READY_FOR_HUMAN_REVIEW",
      "rightsReview": "PENDING_OWNER_ATTESTATION",
      "keyApproval": "PENDING_HUMAN",
      "scoringEligible": false,
      "blockers": [
        "HUMAN_CONTENT_REVIEW",
        "SOURCE_RIGHTS_ATTESTATION",
        "OWNER_FREEZE"
      ],
      "reviewNote": "Historical wording/labels retained; new immutable option order/IDs only. Prior weak-distractor limitations remain; independent human review required.",
      "approvedBy": null,
      "approvedAt": null,
      "provenanceIds": [
        "source-authoring",
        "source-legacy-data"
      ]
    },
    {
      "questionId": "diagv1.a.g5.r1",
      "formId": "form-a",
      "domain": "grammar",
      "authorship": "REUSED_WORDING_OPTIONS_REORDERED",
      "legacyId": "G5",
      "contentReviewMethod": "LLM_ASSISTED_SELF_REVIEW",
      "independentHumanReview": "PENDING",
      "contentReviewOutcome": "NO_IDENTIFIED_AMBIGUITY_AFTER_SELF_REVIEW",
      "candidateReadiness": "CONTENT_READY_FOR_HUMAN_REVIEW",
      "rightsReview": "PENDING_OWNER_ATTESTATION",
      "keyApproval": "PENDING_HUMAN",
      "scoringEligible": false,
      "blockers": [
        "HUMAN_CONTENT_REVIEW",
        "SOURCE_RIGHTS_ATTESTATION",
        "OWNER_FREEZE"
      ],
      "reviewNote": "Historical wording/labels retained; new immutable option order/IDs only. Prior weak-distractor limitations remain; independent human review required.",
      "approvedBy": null,
      "approvedAt": null,
      "provenanceIds": [
        "source-authoring",
        "source-legacy-data"
      ]
    },
    {
      "questionId": "diagv1.a.g06.r1",
      "formId": "form-a",
      "domain": "grammar",
      "authorship": "REVISED_LLM_ASSISTED",
      "legacyId": "G6",
      "contentReviewMethod": "LLM_ASSISTED_SELF_REVIEW",
      "independentHumanReview": "PENDING",
      "contentReviewOutcome": "NO_IDENTIFIED_AMBIGUITY_AFTER_SELF_REVIEW",
      "candidateReadiness": "CONTENT_READY_FOR_HUMAN_REVIEW",
      "rightsReview": "PENDING_OWNER_ATTESTATION",
      "keyApproval": "PENDING_HUMAN",
      "scoringEligible": false,
      "blockers": [
        "HUMAN_CONTENT_REVIEW",
        "SOURCE_RIGHTS_ATTESTATION",
        "OWNER_FREEZE"
      ],
      "reviewNote": "Original G6 remains disputed in historical archive; this new item fixes the requested temporal construction.",
      "approvedBy": null,
      "approvedAt": null,
      "provenanceIds": [
        "source-authoring",
        "source-legacy-data"
      ]
    },
    {
      "questionId": "diagv1.a.v01.r1",
      "formId": "form-a",
      "domain": "vocabulary",
      "authorship": "REVISED_LLM_ASSISTED",
      "legacyId": "V1",
      "contentReviewMethod": "LLM_ASSISTED_SELF_REVIEW",
      "independentHumanReview": "PENDING",
      "contentReviewOutcome": "NO_IDENTIFIED_AMBIGUITY_AFTER_SELF_REVIEW",
      "candidateReadiness": "CONTENT_READY_FOR_HUMAN_REVIEW",
      "rightsReview": "PENDING_OWNER_ATTESTATION",
      "keyApproval": "PENDING_HUMAN",
      "scoringEligible": false,
      "blockers": [
        "HUMAN_CONTENT_REVIEW",
        "SOURCE_RIGHTS_ATTESTATION",
        "OWNER_FREEZE"
      ],
      "reviewNote": "Removes sudden from the proposed gloss and adds a clear context.",
      "approvedBy": null,
      "approvedAt": null,
      "provenanceIds": [
        "source-authoring",
        "source-legacy-data"
      ]
    },
    {
      "questionId": "diagv1.a.v2.r1",
      "formId": "form-a",
      "domain": "vocabulary",
      "authorship": "REUSED_WORDING_OPTIONS_REORDERED",
      "legacyId": "V2",
      "contentReviewMethod": "LLM_ASSISTED_SELF_REVIEW",
      "independentHumanReview": "PENDING",
      "contentReviewOutcome": "NO_IDENTIFIED_AMBIGUITY_AFTER_SELF_REVIEW",
      "candidateReadiness": "CONTENT_READY_FOR_HUMAN_REVIEW",
      "rightsReview": "PENDING_OWNER_ATTESTATION",
      "keyApproval": "PENDING_HUMAN",
      "scoringEligible": false,
      "blockers": [
        "HUMAN_CONTENT_REVIEW",
        "SOURCE_RIGHTS_ATTESTATION",
        "OWNER_FREEZE"
      ],
      "reviewNote": "Historical wording/labels retained; new immutable option order/IDs only. Prior weak-distractor limitations remain; independent human review required.",
      "approvedBy": null,
      "approvedAt": null,
      "provenanceIds": [
        "source-authoring",
        "source-legacy-data"
      ]
    },
    {
      "questionId": "diagv1.a.v3.r1",
      "formId": "form-a",
      "domain": "vocabulary",
      "authorship": "REUSED_WORDING_OPTIONS_REORDERED",
      "legacyId": "V3",
      "contentReviewMethod": "LLM_ASSISTED_SELF_REVIEW",
      "independentHumanReview": "PENDING",
      "contentReviewOutcome": "NO_IDENTIFIED_AMBIGUITY_AFTER_SELF_REVIEW",
      "candidateReadiness": "CONTENT_READY_FOR_HUMAN_REVIEW",
      "rightsReview": "PENDING_OWNER_ATTESTATION",
      "keyApproval": "PENDING_HUMAN",
      "scoringEligible": false,
      "blockers": [
        "HUMAN_CONTENT_REVIEW",
        "SOURCE_RIGHTS_ATTESTATION",
        "OWNER_FREEZE"
      ],
      "reviewNote": "Historical wording/labels retained; new immutable option order/IDs only. Prior weak-distractor limitations remain; independent human review required.",
      "approvedBy": null,
      "approvedAt": null,
      "provenanceIds": [
        "source-authoring",
        "source-legacy-data"
      ]
    },
    {
      "questionId": "diagv1.a.v4.r1",
      "formId": "form-a",
      "domain": "vocabulary",
      "authorship": "REUSED_WORDING_OPTIONS_REORDERED",
      "legacyId": "V4",
      "contentReviewMethod": "LLM_ASSISTED_SELF_REVIEW",
      "independentHumanReview": "PENDING",
      "contentReviewOutcome": "NO_IDENTIFIED_AMBIGUITY_AFTER_SELF_REVIEW",
      "candidateReadiness": "CONTENT_READY_FOR_HUMAN_REVIEW",
      "rightsReview": "PENDING_OWNER_ATTESTATION",
      "keyApproval": "PENDING_HUMAN",
      "scoringEligible": false,
      "blockers": [
        "HUMAN_CONTENT_REVIEW",
        "SOURCE_RIGHTS_ATTESTATION",
        "OWNER_FREEZE"
      ],
      "reviewNote": "Historical wording/labels retained; new immutable option order/IDs only. Prior weak-distractor limitations remain; independent human review required.",
      "approvedBy": null,
      "approvedAt": null,
      "provenanceIds": [
        "source-authoring",
        "source-legacy-data"
      ]
    },
    {
      "questionId": "diagv1.a.v5.r1",
      "formId": "form-a",
      "domain": "vocabulary",
      "authorship": "REUSED_WORDING_OPTIONS_REORDERED",
      "legacyId": "V5",